{
  "$schema": "http://json-schema.org/draft-07/schema#",
  "title": "Fabulist studio manifest (fabulist.json)",
  "type": "object",
  "properties": {
    "name": {
      "type": "string",
      "description": "studio name, shown in the rail and project list"
    },
    "description": {
      "type": "string",
      "description": "one line about the studio"
    },
    "version": {
      "type": [
        "string",
        "number"
      ],
      "description": "manifest schema version; currently 1"
    },
    "template": {
      "type": "boolean",
      "description": "mark this project as a studio template: opening it offers \"new project from this studio\" instead of editing it in place"
    },
    "fileTypes": {
      "type": "array",
      "description": "Typed kinds of files this studio works with, matched by filename glob. A matching file gets the icon and label in the rail, its title derived per titleFrom, and a card in the New File dialog (the filename follows the glob, the template seeds the content). Any file kind can be typed (.md, .html, .json, .py, …) — every textual file and image is already a work file; a file type adds meaning on top.",
      "items": {
        "type": "object",
        "properties": {
          "id": {
            "type": "string",
            "description": "stable identifier"
          },
          "match": {
            "type": "string",
            "description": "project-relative filename glob; * and ? stay within one path segment, ** spans folders"
          },
          "label": {
            "type": "string",
            "description": "display label; defaults to the id"
          },
          "icon": {
            "type": "string",
            "description": "1–2 characters/emoji shown in the file rail",
            "maxLength": 2
          },
          "titleFrom": {
            "type": "string",
            "description": "\"h1\" (default), \"filename\", or \"frontmatter:<key>\""
          },
          "template": {
            "type": "string",
            "description": "seed content for new files of this type; {{title}} is substituted"
          }
        },
        "required": [
          "id",
          "match"
        ],
        "additionalProperties": true
      }
    },
    "actions": {
      "type": "array",
      "description": "Commands surfaced in the ⌘K palette (and, for surface \"selection\", in the highlight toolbar). An action runs a .claude/skills skill, sends a canned prompt, or both.",
      "items": {
        "type": "object",
        "properties": {
          "id": {
            "type": "string",
            "description": "stable identifier; defaults to a slug of the label"
          },
          "label": {
            "type": "string",
            "description": "palette label (required unless a skill names it)"
          },
          "surface": {
            "enum": [
              "selection",
              "file",
              "project"
            ],
            "description": "what the action operates on; \"selection\" needs highlighted text"
          },
          "skill": {
            "type": "string",
            "description": "a .claude/skills name to invoke"
          },
          "prompt": {
            "type": "string",
            "description": "instructions sent to the project agent (alongside or instead of the skill)"
          }
        },
        "required": [],
        "additionalProperties": true
      }
    },
    "panels": {
      "type": "array",
      "description": "Read-only rendered views over project files, opened as ▦ tabs from the rail or palette.",
      "items": {
        "type": "object",
        "properties": {
          "id": {
            "type": "string",
            "description": "stable identifier; defaults to a slug of the title"
          },
          "title": {
            "type": "string",
            "description": "tab and rail label"
          },
          "source": {
            "type": "string",
            "description": "project-relative file the panel renders"
          },
          "view": {
            "enum": [
              "markdown",
              "code",
              "image",
              "web"
            ],
            "description": "how the source is rendered: \"markdown\" (default) renders prose, \"code\" shows syntax-highlighted source, \"image\" displays a picture file, \"web\" embeds the file as a live page (relative assets and scripts work)"
          }
        },
        "required": [
          "title",
          "source"
        ],
        "additionalProperties": true
      }
    },
    "commands": {
      "type": "array",
      "description": "Shell commands the studio can run at the project root (dev server, build, tests…), started only by the user from the rail — never by the agent — with the exact command line always shown. Output streams into a log tab; a long-running command keeps a ● running indicator until stopped.",
      "items": {
        "type": "object",
        "properties": {
          "id": {
            "type": "string",
            "description": "stable identifier; defaults to a slug of the label"
          },
          "label": {
            "type": "string",
            "description": "rail label (required unless id is given)"
          },
          "run": {
            "type": "string",
            "description": "the shell command line, run at the project root"
          },
          "preview": {
            "type": "string",
            "description": "a localhost URL embedded as a live preview beside the log while the command runs"
          }
        },
        "required": [
          "run"
        ],
        "additionalProperties": true
      }
    },
    "permissions": {
      "type": "object",
      "description": "Gate profile; loosening grants requires user trust in the app.",
      "properties": {
        "edits": {
          "enum": [
            "ask",
            "auto"
          ],
          "description": "\"auto\" applies the agent's file edits without per-edit approval; only takes effect after the user explicitly trusts the studio in the app"
        },
        "bash": {
          "enum": [
            "ask",
            "deny"
          ],
          "description": "\"deny\" removes the shell tool from the agent entirely (tightening never needs trust)"
        },
        "mcp": {
          "enum": [
            "none",
            "ask",
            "allow"
          ],
          "description": "project MCP servers (.mcp.json + .claude/settings.json enablement): \"none\" (default) ignores them, \"ask\" connects them with per-tool approval, \"allow\" connects and auto-approves their tools; anything but \"none\" requires the user to trust the studio"
        }
      },
      "additionalProperties": true
    }
  },
  "additionalProperties": true
}
