{
  "$schema": "../../docs/fabulist.schema.json",
  "name": "Essay Studio",
  "description": "Essays and newsletters: drafts held to your own style guide",
  "version": 1,
  "template": true,
  "fileTypes": [
    {
      "id": "draft",
      "match": "drafts/*.md",
      "label": "Draft",
      "icon": "✍",
      "template": "# {{title}}\n\n*The one thing this piece says:* \n\n"
    }
  ],
  "actions": [
    { "label": "Sharpen this argument", "surface": "selection", "prompt": "This passage is making an argument. Point out the weakest link in it, then rewrite the passage to fix it. Keep my voice." },
    { "label": "Style pass", "surface": "file", "skill": "style-pass" },
    { "label": "Hunt weasel words", "surface": "file", "prompt": "Find hedges and weasel words in this draft (somewhat, arguably, very, quite, I think). Either cut them or replace them with a concrete claim. Edit the document directly." }
  ],
  "panels": [
    { "id": "style", "title": "Style Guide", "source": "style-guide.md" }
  ]
}
